pk,desa,direccion,ubicacion,localidad,cod_postal,isla,x,y,vigencia_inicio,vigencia_fin
313,DESA00445,AVDA AMSTERDAM (DE) 8,HOTEL MAR Y SOL: Recepción,Arona,38650,TENERIFE,332184,3.10388e+006,20170908000000,
314,DESA00446,CALLE LONDRES 11,HOTEL PARQUE DEL SOL: Recepción,Adeje,38660,TENERIFE,329446,3.10831e+006,20170908000000,
315,DESA00447,AVDA MARITIMA (PLAYA BLANCA) S/N,GASOLINERA MARINA RUBICÓN: Oficina,Yaiza,35570,LANZAROTE,615519,3.19296e+006,20170908000000,
316,DESA00448,CALLE EMILIO CALZADILLA 32,C.P.E.I.P.S. COLEGIO MONTESSORI: Recepción,Santa Cruz de Tenerife,38002,TENERIFE,377656,3.1498e+006,20170908000000,
317,DESA00452,CALLE BERRUGO (EL) 2,EDIFICIO MARINA RUBICÓN: Oficina edificio central,Yaiza,35570,LANZAROTE,615526,3.19308e+006,20170908000000,
318,DESA00453,AVDA UNION (LA) GUAJARA S/N,C A MODAS: Interior de la tienda,Laguna (La),38205,TENERIFE,372094,3.14936e+006,20170908000000,
319,DESA00454,AVDA ANAGA (DE) 57,FARMACIA ANAGA: Rebotica,Santa Cruz de Tenerife,38001,TENERIFE,378291,3.15087e+006,20170908000000,
320,DESA00455,PLAZA JUNTA SUPREMA 4,FARMACIA SAN AGUSTIN: Rebotica,Laguna (La),38201,TENERIFE,370878,3.15229e+006,20170908000000,
321,DESA00456,AVDA CONSTITUCION (LA) 1,AUDITORIO DE TENERIFE: Hall central junto taquilla,Santa Cruz de Tenerife,38002,TENERIFE,377526,3.14835e+006,20170908000000,
322,DESA00458,CALLE DELGADO BARRETO S/N,CAMPUS CENTRAL ULL: Antesala paraninfo,Laguna (La),38204,TENERIFE,371116,3.15126e+006,20170908000000,
323,DESA00459,AVDA SAN SEBASTIAN 10,ESPACIO DE LAS ARTES DE TENERIFE: Recepción principal,Santa Cruz de Tenerife,38003,TENERIFE,377531,3.14923e+006,20170908000000,
324,DESA00460,AVDA SAN SEBASTIAN 10,ESPACIO DE LAS ARTES DE TENERIFE: Recepción biblioteca,Santa Cruz de Tenerife,38003,TENERIFE,377609,3.14919e+006,20170908000000,
325,DESA00463,CALLE DIAZ Y SUAREZ 1,AYUNTAMIENTO DE GARAFÍA: Entrada.,Garafia,38787,LA PALMA,212599,3.19271e+006,20170908000000,
326,DESA00464,CALLE MACHINES (LOS) S/N,CENTRO ASISTENCIAL SOR JOSEFA GAROTE: Entrada,Garafia,38787,LA PALMA,220984,3.19232e+006,20170908000000,
327,DESA00465,CALLE VIA LACTEA S/N,POLIDEPORTIVO MEDARDO PÉREZ: Entrada.,Garafia,38787,LA PALMA,212217,3.19259e+006,20170908000000,
328,DESA00466,CALLE SUBIDA AL MAYORAZGO 7 NAVE Nº 9,CENTRO LOGÍSTICO DE EMERGENCIAS: Entrada,Santa Cruz de Tenerife,38108,TENERIFE,374420,3.1471e+006,20170908000000,
329,DESA00468,PLAZA PATRIOTISMO (EL) 1,SEDE LA CAIXA: Acceso planta baja junto puesto vigilancia..,Santa Cruz de Tenerife,38002,TENERIFE,377555,3.14984e+006,20170908000000,
330,DESA00470,"CALLE ENLACE MAYORAZGO-MERCATENERIFE 5 COMPLEJO D, NAVE 5",ASOCIACION BANCO ALIMENTOS DE TENERIFE: Nave 5  en interior  junto escaleras,Santa Cruz de Tenerife,38010,TENERIFE,374655,3.14673e+006,20170908000000,
331,DESA00471,CALLE EL CABLE S/N,CENTRO INSULAR DE DEPORTES NÁUTICOS: Entrada,Arrecife,35509,LANZAROTE,639206,3.20378e+006,20170908000000,
332,DESA00472,AVDA RAMBLA MEDULAR S/N,CONSERVATORIO DE MUSICA: Entrada,Arrecife,35500,LANZAROTE,640744,3.20505e+006,20170908000000,
333,DESA00473,CALLE SALVADOR ALLENDE S/N,EDIFICIO BIENESTAR SOCIAL: Entrada,Arrecife,35500,LANZAROTE,640606,3.20515e+006,20170908000000,
334,DESA00474,RBLA MEDULAR 65,TEATRO INSULAR: Entrada,Arrecife,35500,LANZAROTE,640825,3.20504e+006,20170908000000,
335,DESA00475,AVDA FRED OLSEN S/N,CABILDO INSULAR DE LANZAROTE: Entrada,Arrecife,35500,LANZAROTE,640009,3.20419e+006,20170908000000,
336,DESA00476,RBLA MEDULAR 42,BIBLIOTECA MUNICIPAL: Entrada,Arrecife,35500,LANZAROTE,640825,3.20504e+006,20170908000000,
337,DESA00477,AVDA ALCALDE GINES DE LA HOZ 0,CIUDAD DEPORTIVA DE ARRECIFE: Entrada,Arrecife,35500,LANZAROTE,640753,3.20522e+006,20170908000000,
338,DESA00478,AVDA LAS AMERICAS S/N,HOTEL MEDITERRANEAN PALACE: Hall de recepción,Arona,38660,TENERIFE,330022,3.1044e+006,20170908000000,
339,DESA00479,AVDA LAS AMERICAS  S/N,PIRÁMIDES DE ARONA: Hall entrada al auditorio,Arona,38660,TENERIFE,329854,3.10446e+006,20170908000000,
340,DESA00480,CALLE DUNAS (LAS) S/N,HOTEL ATLANTIS FUERTEVENTURA: Recepción,Oliva La,35660,FUERTEVENTURA,611453,3.17854e+006,20170908000000,
341,DESA00481,AVDA MADROÑAL 10,C.P.E.I.P.S. INTERNACIONAL COSTA ADEJE: Recepción,Adeje,38660,TENERIFE,330373,3.10898e+006,20170908000000,
342,DESA00482,PLAZA PLAYA DEL DUQUE S/N,C.C. PLAZA DEL DUQUE: Zona de cajeros planta 1,Adeje,38679,TENERIFE,329129,3.10849e+006,20170908000000,
343,DESA00483,CALLE DOCTOR BARAJAS 19,HOTEL LAS AGUILAS: Hall recepción del hotel,Puerto de la Cruz,38400,TENERIFE,348556,3.14247e+006,20170908000000,
344,DESA00484,CALLE HERMANOS MARRERO 2,ASAMBLEA CRUZ ROJA LA LAGUNA: Recepción,Laguna (La),38201,TENERIFE,370729,3.15228e+006,20170908000000,
345,DESA00485,PLAZA PEDRO PEREZ DIAZ S/N,POLICÍA LOCAL MAZO: Dependencias,Mazo,38730,LA PALMA,228189,3.16751e+006,20170908000000,
346,DESA00486,CALLE HONDURAS 55,C.E.E. CHACONA: Pasillo comedor,Guimar,38500,TENERIFE,361182,3.13413e+006,20170908000000,
347,DESA00487,CALLE VELAZQUEZ 11,C.E.E. SALVADOR RUEDA: Entrada,Palmas de Gran Canaria (Las),35005,GRAN CANARIA,457635,3.11085e+006,20170908000000,
348,DESA00488,AVDA ARCHIPIELAGO CANARIO 12,C.E.E. INES FUENTES: Exterior consulta médica,Puerto de la Cruz,38400,TENERIFE,347228,3.14234e+006,20170908000000,
349,DESA00489,AVDA FERIA DE LA 3,C.E.E. SIETE PALMAS: Pasillo central,Palmas de Gran Canaria (Las),35012,GRAN CANARIA,455958,3.10899e+006,20170908000000,
350,DESA00490,URB MARENTE S/N,C.E.E. MARENTE: Pasillo aulas  patio central,Santa Maria de Guia de Gran Canaria,35450,GRAN CANARIA,437450,3.11308e+006,20170908000000,
351,DESA00491,CALLE MAJADA MARCIAL SN S/N PAREDONES,C.E.E. PUERTO DEL ROSARIO: Pasillo izquierdo  frente al despacho del director,Puerto del Rosario,35600,FUERTEVENTURA,610783,3.15426e+006,20170908000000,
352,DESA00492,CSRIO LOMO ESPANTA 39,C.E.E. El DORADOR: Despacho Psicólogo,Santa Cruz de la Palma,38715,LA PALMA,229088,3.17815e+006,20170908000000,
353,DESA00493,CALLE ARCIPRESTE DE HITA S/N,C.E.E. N  SEÑORA DE LOS VOLCANES: Pasillo general  entrada principal,Teguise,35509,LANZAROTE,642293,3.20892e+006,20170908000000,
354,DESA00494,CTRA JEREZ-HUESAS LAS 2,C.E.E. PETRA LORENZO: Secretaría,Telde,35208,GRAN CANARIA,458630,3.09466e+006,20170908000000,
355,DESA00495,CTRA GENERAL DEL SUR S/N KM 10,COLEGIO RODRIGUEZ CAMPOS: Sala de profesores,Rosario (El),38108,TENERIFE,370523,3.14408e+006,20170908000000,
356,DESA00496,CALLE SAN JUAN VALVERDE 13,I.E.S. GAROE: Administración,Valverde del Hierro,38900,EL HIERRO,212948,3.07936e+006,20170908000000,
357,DESA00497,CALLE FERNANDO PADILLA 1,I.E.S. SAN SEBASTIAN DE LA GOMERA: Conserjería pared exterior,San Sebastian de la Gomera,38800,LA GOMERA,292059,3.10975e+006,20170908000000,
358,DESA00498,CALLE RESBALA (LA) S/N,CAMPO DE FUTBOL: Interior la cantina,Matanza de Acentejo (La),38370,TENERIFE,357790,3.14766e+006,20170908000000,
359,DESA00499,CTRA GENERAL DEL NORTE S/N,MERCADILLO: Recepción,Matanza de Acentejo (La),38370,TENERIFE,357260,3.14761e+006,20170908000000,
360,DESA00500,CALLE RESBALA (LA) S/N,PABELLÓN DE DEPORTES: Nivel cancha de baloncesto,Matanza de Acentejo (La),38370,TENERIFE,357852,3.1476e+006,20170908000000,
361,DESA00501,CALLE SANTIAGO CUADRADO 14,C.P.E.I.P.S. MAYEX: Sala fotocopiadora,Laguna (La),38201,TENERIFE,371251,3.15234e+006,20170908000000,
362,DESA00502,CTRA GENERAL 120,CAMPO DE FUTBOL HERMIGUA: Vestuarios,Hermigua,38280,LA GOMERA,284186,3.11728e+006,20170908000000,
363,DESA00504,PLAZA  DE ESPAÑA 1,PALACIO INSULAR: Entrada principal  próximo ascensor torre,Santa Cruz de Tenerife,38003,TENERIFE,377908,3.14947e+006,20170908000000,
364,DESA00505,CALLE ALCALDE MANDILLO TEJERA 8,EDIFICIO PLANIFICACION TERRITORIAL: Hall planta 0 frente ascensor,Santa Cruz de Tenerife,38007,TENERIFE,375341,3.14908e+006,20170908000000,
365,DESA00506,CTRA AL MONTE LAS MERCEDES KM 6,CENTRO VISITANTES: Entrada,Laguna (La),38208,TENERIFE,374745,3.15667e+006,20170908000000,
366,DESA00507,CALLE MACETAS (LAS) S/N,PABELLÓN DEPORTIVO: Entrada principal  pared del registro,Laguna (La),38108,TENERIFE,372976,3.14872e+006,20170908000000,
367,DESA00508,CALLE TINERFE EL GRANDE 32,RECAUDACION MUNICIPAL: Acceso escalera 0,Adeje,38670,TENERIFE,330437,3.11152e+006,20170908000000,
368,DESA00509,AVDA TRES DE MAYO 79,POLICÍA LOCAL: Coche patrulla,Santa Cruz de Tenerife,38005,TENERIFE,376643,3.1486e+006,20170908000000,
369,DESA00510,AVDA TRES DE MAYO 79,POLICÍA LOCAL: Coche patrulla,Santa Cruz de Tenerife,38005,TENERIFE,376633,3.1486e+006,20170908000000,
370,DESA00511,AVDA TRES DE MAYO 79,POLICÍA LOCAL: Coche patrulla,Santa Cruz de Tenerife,38005,TENERIFE,376637,3.14858e+006,20170908000000,
371,DESA00512,AVDA TRES DE MAYO 79,POLICÍA LOCAL: Coche patrulla,Santa Cruz de Tenerife,38005,TENERIFE,376650,3.14859e+006,20170908000000,
372,DESA00513,AVDA TRES DE MAYO 79,POLICÍA LOCAL: Coche patrulla,Santa Cruz de Tenerife,38005,TENERIFE,376643,3.14859e+006,20170908000000,
373,DESA00514,AVDA TRES DE MAYO 79,POLICÍA LOCAL: Coche patrulla,Santa Cruz de Tenerife,38005,TENERIFE,376642,3.14859e+006,20170908000000,
374,DESA00515,CALLE GRANDE 1,AYUNTAMIENTO DE ADEJE: Recepción,Adeje,38670,TENERIFE,330638,3.112e+006,20170908000000,
375,DESA00516,AVDA AYYO (DE) S/N,POLICÍA LOCAL: Recepción Registro,Adeje,38679,TENERIFE,329089,3.11211e+006,20170908000000,
376,DESA00518,AVDA PALO MAYOR 5,PABELLÓN GALEÓN: Administración Recepción,Adeje,38670,TENERIFE,330074,3.11103e+006,20170908000000,
377,DESA00519,CALLE TAGARA 2,COMPLEJO DEPORTIVO PABELLÓN LAS TORRES: Administración,Adeje,38679,TENERIFE,329254,3.11188e+006,20170908000000,
378,DESA00520,CALLE JARCIAS (LAS) S/N EL GALEON,CENTRO DESARROLLO TURISTICO COSTA ADEJE: Entrada.,Adeje,38670,TENERIFE,330013,3.1112e+006,20170908000000,
379,DESA00521,CALLE ISLA DE GRAN CANARIA S/N,MERCADO MUNICIPAL: Entrada,Valsequillo de Gran Canaria,35217,GRAN CANARIA,450960,3.09645e+006,20170908000000,
380,DESA00522,CALLE ISLA DE TENERIFE,PISCINA MUNICIPAL: Entrada,Valsequillo de Gran Canaria,35217,GRAN CANARIA,451020,3.09667e+006,20170908000000,
381,DESA00523,AVDA JUAN CARLOS I S/N,POLICÍA LOCAL: Entrada,Valsequillo de Gran Canaria,35217,GRAN CANARIA,451089,3.09632e+006,20170908000000,
382,DESA00524,CALLE LA HAYA 3,HOTEL WEARE LA PAZ: Recepción,Puerto de la Cruz,38400,TENERIFE,349228,3.14407e+006,20170908000000,
383,DESA00526,CALLE GARA Y JONAY 1,C.E.E. HERMANO PEDRO: Pasillo Enfermería,Santa Cruz de Tenerife,38010,TENERIFE,374476,3.14766e+006,20170908000000,
384,DESA00527,AVDA RAFAEL PUIG LLUVINIA 12,HOTEL SOL TENERIFE: Hall Torre A,Adeje,38660,TENERIFE,329861,3.10552e+006,20170908000000,
385,DESA00528,AVDA RAFAEL PUIG LLUVINIA 12,HOTEL SOL TENERIFE: Hall Torre B,Adeje,38660,TENERIFE,329808,3.10555e+006,20170908000000,
386,DESA00529,AVDA RAFAEL PUIG LLUVINIA 12,HOTEL SOL TENERIFE: Piscinas,Adeje,38660,TENERIFE,329781,3.10551e+006,20170908000000,
387,DESA00530,CALLE BARCELONA 4,C.E.I.P. ALCARAVANERAS: Pasillo Hall infantil,Palmas de Gran Canaria (Las),35006,GRAN CANARIA,457675,3.11205e+006,20170908000000,
388,DESA00531,CALLE MANUEL DE FALLA 16,FARMACIA LAURA CATALAN VICENTE: Rebotica,Llanos de Aridane (Los),38767,LA PALMA,214448,3.17367e+006,20170908000000,
389,DESA00532,CALLE BENCOMO 16,GERENCIA URBANISMO: Acceso área privada,Laguna (La),38201,TENERIFE,371286,3.15207e+006,20170908000000,
390,DESA00533,AVDA JOSE AGUIAR 1,POLIDEPORTIVO MUNICIPAL: Entrada principal campo de futbol,San Sebastian de la Gomera,38800,LA GOMERA,291900,3.10982e+006,20170908000000,
391,DESA00536,CALLE LAS ACASIAS 1 ESQ CALLE ISLA DE LA GOMERA,CENTRO DEPORTIVO LA JURADA: Recepción.,Granadilla de Abona,38611,TENERIFE,347511,3.10649e+006,20170908000000,
392,DESA00537,CTRA GENERAL DE JANDIA S/N KM 7,OASIS PARK FUERTEVENTURA: Info center,Pajara,35627,FUERTEVENTURA,582775,3.11824e+006,20170908000000,
393,DESA00538,CTRA GENERAL DE JANDIA S/N KM 7,OASIS PARK FUERTEVENTURA: Restaurante Leones,Pajara,35627,FUERTEVENTURA,582802,3.11827e+006,20170908000000,
394,DESA00539,TRANSVERSAL  LUIS VIVES 7,PABELLÓN LUIS VIVES: Vestuario,Laguna (La),38108,TENERIFE,373212,3.14702e+006,20170908000000,
395,DESA00540,CALLE PATA ABAJO S/N EL FUERTE,PLANTA LLENADO GLP DISA: recepción,Breña Baja,38712,LA PALMA,229582,3.17367e+006,20170908000000,
396,DESA00541,POLÍGONO INDUSTRIAL DE GRANADILLA S/N,PLANTA LLENADO GLP DISA: recepción,Granadilla de Abona,38600,TENERIFE,352558,3.1078e+006,20170908000000,
397,DESA00542,CALLE ARENALES 20,HOTEL MARYLANZA SUITES SPA: Recepción,Arona,38650,TENERIFE,330709,3.10501e+006,20170908000000,
398,DESA00543,CALLE COLOGAN 2,SEDE POLICIA LOCAL: Entrando pasillo derecha,Orotava (La),38300,TENERIFE,350513,3.14142e+006,20170908000000,
399,DESA00544,CALLE EDUCADORA LUCIA MESA S/N,SEDE PROTECCION CIVIL: Salón de reuniones I,Orotava (La),38300,TENERIFE,350915,3.14126e+006,20170908000000,
400,DESA00545,CALLE EDUCADORA LUCIA MESA S/N,SEDE PROTECCION CIVIL: Salón de reuniones II.,Orotava (La),38300,TENERIFE,350916,3.14125e+006,20170908000000,
401,DESA00546,CALLE LEON 9,CASA DE LA JUVENTUD: Entrada recepción derecha,Orotava (La),38300,TENERIFE,350685,3.14128e+006,20170908000000,
402,DESA00547,AVDA SOR SOLEDAD COBIAN S/N,ESTADIO M. LOS CUARTOS: Despacho conserje,Orotava (La),38300,TENERIFE,351423,3.14156e+006,20170908000000,
403,DESA00548,CALLE COLOGAN 2,SEDE POLICÍA LOCAL: Vehículo atestados,Orotava (La),38300,TENERIFE,350515,3.14141e+006,20170908000000,
404,DESA00549,CALLE CALVARIO 4,OFICINA M. DE TURISMO: Almacén,Orotava (La),38300,TENERIFE,350834,3.14152e+006,20170908000000,
405,DESA00550,CALLE TOMAS PEREZ 3,BIBLIOTECA MUNICIPAL: Recepción,Orotava (La),38300,TENERIFE,350582,3.14133e+006,20170908000000,
406,DESA00551,CALLE TRIANA 83,CAIXABANK: Planta baja,Palmas de Gran Canaria (Las),35002,GRAN CANARIA,459066,3.10909e+006,20170908000000,
407,DESA00552,LUGAR BALITO 1,COMPLEJO MARINA ÉLITE: Recepción,Mogan,35130,GRAN CANARIA,430813,3.07262e+006,20170908000000,
408,DESA00553,CALLE NUEVA ARONA S/N,SEDE POLICÍA LOCAL: Entrada central derecha,Arona,38640,TENERIFE,334976,3.10942e+006,20170908000000,
409,DESA00554,PLAZA CRISTO DE LA SALUD 1,AYUNTAMIENTO: Entrada fondo a la derecha,Arona,38640,TENERIFE,334890,3.10943e+006,20170908000000,
410,DESA00555,CALLE MEDIO (DEL) S/N,LOCAL MULTAS INFRACCIONES Y MEDIO AMBIENTE: Entrada en frente vestíbulo,Arona,38640,TENERIFE,334833,3.10934e+006,20170908000000,
411,DESA00556,CALLE DIVINA PASTORA 58 CTRA GENERAL TF-28,C.C. LA CAMELLA: Entrada a la izquierda,Arona,38640,TENERIFE,334695,3.10706e+006,20170908000000,
412,DESA00557,CALLE LLANO MORA 10,C.C. VALLE SAN LORENZO: Entrada a la izquierda,Arona,38626,TENERIFE,337127,3.10834e+006,20170908000000,
413,DESA00558,CALLE VISTA MARTIN 28,C.C. CABO BLANCO: Junto al mostrador de recepción,Arona,38626,TENERIFE,335819,3.10649e+006,20170908000000,
414,DESA00559,CALLE PETALO 1,C.C. PARQUE LA REINA: Entrada a la izquierda,Arona,38627,TENERIFE,336544,3.10376e+006,20170908000000,
415,DESA00560,CALLE SAN SEBASTIAN DE LA GOMERA S/N,C.C. EL FRAILE: Bloque sur  junto a mostrador recepción,Arona,38632,TENERIFE,335734,3.09972e+006,20170908000000,
416,DESA00561,RBLA DIONISIO GONZALEZ 20,CENTRO EMPRESARIAL LAS GALLETAS: Mostrador a la derecha entrada,Arona,38631,TENERIFE,337026,3.09916e+006,20170908000000,
417,DESA00562,URB VIRGEN DEL CARMEN S/N BLOQUE 4,LOCAL SOCIO CULTURAL VIRGEN DEL CARMEN GUARGACHO: Sala izquierda local,Arona,38639,TENERIFE,338817,3.10068e+006,20170908000000,
418,DESA00563,CALLE PLAZA  DEL PESCADOR  1,C.C. LOS CRISTIANOS: Entrada a la derecha,Arona,38650,TENERIFE,331530,3.10426e+006,20170908000000,
419,DESA00564,AVDA JUAN CARLOS I 20,AUDITORIO INFANTA LEONOR LOS CRISTIANOS: Entrada vestíbulo,Arona,38650,TENERIFE,331615,3.10424e+006,20170908000000,
420,DESA00565,CALLE PUERTO ESCONDIDO S/N,C.C. PARQUE BULEVAR: Planta nivel 1,Santa Cruz de Tenerife,38002,TENERIFE,377470,3.14998e+006,20170908000000,
421,DESA00566,AVDA GRANDES PLAYAS 12,GRAN HOTEL ATLANTIS BAHIA REAL: Recepción,Oliva La,35660,FUERTEVENTURA,611752,3.17841e+006,20170908000000,
422,DESA00567,RONDA J.N. GALVAN BELLO  16 POLG INDUSTRIAL COSTA SUR,SHEREIBER  DE CANARIAS: Pasillo entrada fabrica,Santa Cruz de Tenerife,38009,TENERIFE,375151,3.14747e+006,20170908000000,
423,DESA00568,BCO LECHUGAL S/N,ANFI EMERAL CLUB: Solárium,Mogan,35120,GRAN CANARIA,429483,3.07566e+006,20170908000000,
424,DESA00569,BCO LECHUGAL S/N,ANFI TAURO GOLF: Recepción,Mogan,35120,GRAN CANARIA,429822,3.07516e+006,20170908000000,
425,DESA00570,BCO DE LA VERGA  S/N,ANFI BEACH CLUB: Recepción,Mogan,35120,GRAN CANARIA,431577,3.07247e+006,20170908000000,
426,DESA00571,BCO DE LA VERGA  S/N,ANFI BEACH CLUB: Solárium,Mogan,35120,GRAN CANARIA,431605,3.07247e+006,20170908000000,
427,DESA00572,BCO DE LA VERGA  S/N,CLUB PUERTO ANFI: Solárium,Mogan,35120,GRAN CANARIA,431212,3.07217e+006,20170908000000,
428,DESA00573,BCO DE LA VERGA  S/N,CLUB MONTE ANFI: Recepción,Mogan,35120,GRAN CANARIA,431234,3.07226e+006,20170908000000,
429,DESA00574,BCO DE LA VERGA  S/N,CLUB MONTE ANFI: Solárium,Mogan,35120,GRAN CANARIA,431210,3.07223e+006,20170908000000,
430,DESA00575,BCO DE LA VERGA  S/N,CLUB GRAN ANFI: Recepción,Mogan,35120,GRAN CANARIA,431047,3.07217e+006,20170908000000,
431,DESA00576,BCO DE LA VERGA  S/N,CLUB GRAN ANFI: Solárium,Mogan,35120,GRAN CANARIA,431052,3.07212e+006,20170908000000,
432,DESA00577,CALLE ROBAYNA 2,MUTUA DE ACCIDENTES: Hall,Santa Cruz de Tenerife,38003,TENERIFE,377226,3.14965e+006,20170908000000,
433,DESA00578,CALLE CURATO  S/N,RESIDENCIA MAYORES: Enfermería,Hermigua,38820,LA GOMERA,284161,3.1175e+006,20170908000000,
434,DESA00579,AVDA GUILLERMO ASCANIO MORENO S/N,CENTRO DISCAPACITADOS: Entrada principal,Vallehermoso,38840,LA GOMERA,277675,3.11927e+006,20170908000000,
435,DESA00581,CALLE J.P. WATT S/N NAVE 5 - POLIG INDUSTRIAL LA CAMPANA,GIMNACIO ZONA O CROSSFIT: Entrada,Rosario (El),38109,TENERIFE,370962,3.14347e+006,20170908000000,
436,DESA00582,BCO LA CONCEPCION S/N,INFRAESTRUCTURAS DE ALMACENAMIENTO DISA: Recepción,San Sebastian de la Gomera,38800,LA GOMERA,291910,3.10879e+006,20170908000000,
437,DESA00583,CALLE TOMAS CRUZ S/N,CENTRO CULTURAL LLANO CAMELLO: Entrada frontal,San Miguel,38639,TENERIFE,340912,3.10455e+006,20170908000000,
438,DESA00584,BCO LA MESA Y BCO RODRIGO S/N,PARQUE CHO PANCHO: Casa del guarda,San Miguel,38629,TENERIFE,339321,3.10455e+006,20170908000000,
439,DESA00585,CALLE INOCENCIA TORRES AFONSO S/N,CAMPO FUTBOL JUANITO MARRERO: Cantina,San Miguel,38628,TENERIFE,341417,3.10676e+006,20170908000000,
440,DESA00586,CALLE EL MONTE S/N,CAMPO DE FUTBOL DE GUARGACHO: Cantina,San Miguel,38639,TENERIFE,339728,3.10229e+006,20170908000000,
441,DESA00587,CALLE ANTONIO ALONSO  S/N,PABELLÓN MUNICIPAL: Puerta entrada público,San Miguel,38620,TENERIFE,341220,3.10891e+006,20170908000000,
442,DESA00588,CTRA ABRIGOS (A LOS) 32,POLICÍA LOCAL: Recepción entrada edificio,San Miguel,38620,TENERIFE,341313,3.10898e+006,20170908000000,
443,DESA00589,CTRA GENERAL DEL SUR  2,CAMPO DE FUTBOL PACO TEJERA: Recepción,San Miguel,38639,TENERIFE,340162,3.10923e+006,20170908000000,
444,DESA00590,URB GOLF DEL SUR S/N,PARQUE ALBATROS: Recepción,San Miguel,38639,TENERIFE,341700,3.10117e+006,20170908000000,
445,DESA00591,CALLE LOMO SALAS S/N,FALCK SCI CANARIAS: Entrada,Telde,35215,GRAN CANARIA,456663,3.0944e+006,20170908000000,
446,DESA00592,CALLE EL PESCUECITO 1,RESIDENCIAL EL LLANO: La piscina puesto socorrista,Valle Gran Rey,38870,LA GOMERA,270575,3.10886e+006,20170908000000,
447,DESA00593,TRANSVERSAL LOS  CANCAJOS 2,HOTEL LAS OLAS: Recepción,Breña Baja,38712,LA PALMA,230287,3.17176e+006,20170908000000,
448,DESA00594,AVDA FERIA DE LA 3,C.E.E.E. 7 PALMAS: Pasillo enfrente enfermería,Palmas de Gran Canaria (Las),35012,GRAN CANARIA,455958,3.10899e+006,20170908000000,
449,DESA00595,CALLE CANCAJOS (LOS) S/N,HACIENDA SAN JORGE: Entrada,Breña Baja,38712,LA PALMA,230114,3.17249e+006,20170908000000,
450,DESA00596,CALLE CRUZ HERRERA 16,RESIDENCIA DE MAYORES PUNTALLANA: Entrada,Puntallana,38714,LA PALMA,231203,3.18369e+006,20170908000000,
451,DESA00597,CALLE JOSE LOPEZ 20,COLEGIO SANTO DOMINGO DE GUZMÁN: 1  Planta,Santa Cruz de la Palma,38700,LA PALMA,229690,3.1764e+006,20170908000000,
452,DESA00598,CALLE JOSE LOPEZ 20,COLEGIO SANTO DOMINGO DE GUZMÁN: 3  Planta,Santa Cruz de la Palma,38700,LA PALMA,229701,3.1764e+006,20170908000000,
453,DESA00599,CALLE JOSE LOPEZ 20,COLEGIO SANTO DOMINGO DE GUZMÁN: Canchas,Santa Cruz de la Palma,38700,LA PALMA,229647,3.17636e+006,20170908000000,
454,DESA00600,CTRA CHARCO VERDE 255,HOTEL SOL MELIA LA PALMA: Recepción,Llanos de Aridane (Los),38769,LA PALMA,215467,3.16517e+006,20170908000000,
455,DESA00601,AVDA ISLAS CANARIAS 134,GOLF DEL SUR: Patio entrada izquierda en Casa Club,San Miguel,38639,TENERIFE,341779,3.10196e+006,20170908000000,
456,DESA00602,CMNO LLANOS (DE LOS) S/N,VERSUS POINT PAINTBALL: Recepción Edf. Principal,Guimar,38500,TENERIFE,363472,3.1313e+006,20170908000000,
457,DESA00603,CALLE HERMANO PEDRO DE BETHENCOURT 15,ESCUELA OFICIAL DE IDIOMAS DE LOS CRISTIANOS: Entrada a la izquierda,Arona,38650,TENERIFE,332154,3.10446e+006,20170908000000,
458,DESA00604,AVDA MARITIMA 7,APARTAMENTOS CHARCO DEL CONDE: Entrada a recepción,Valle Gran Rey,38870,LA GOMERA,270242,3.10899e+006,20170908000000,
459,DESA00605,AVDA ITALIA (DE) 21,HL SUITE HOTEL PLAYA DEL INGLES : Recepción,San Bartolome de Tirajana,35100,GRAN CANARIA,444103,3.07069e+006,20170908000000,
460,DESA00606,CALLE BARRILLA 7 CASTILLO CALETA DE FUSTE,MPMH CLUB CALETA DORADA: Recepción.,Antigua,35610,FUERTEVENTURA,610884,3.14168e+006,20170908000000,
461,DESA00607,AVDA PEDRO Y GUY VANDAELE S/N,LABRANDA ALEO CLUB: Recepción.,Oliva La,35660,FUERTEVENTURA,611222,3.17808e+006,20170908000000,
462,DESA00608,AVDA TENERIFE (DE) 2 MASPALOMAS,LAMBRADA PLAYA BONITA: Recepción,San Bartolome de Tirajana,35100,GRAN CANARIA,444400,3.07114e+006,20170908000000,
463,DESA00609,AVDA ALCALDE JUAN RAMON SOTO MORALES 15,MPMH APARTHOTEL CALETA GARDEN: Recepción,Antigua,35610,FUERTEVENTURA,611790,3.142e+006,20170908000000,
464,DESA00610,AVDA BRUSELAS (DE) 8,HOTEL LAMBRADA ISLA: Recepción,Adeje,38660,TENERIFE,329632,3.10829e+006,20170908000000,
465,DESA00611,AVDA GRAN CANARIA 2 CORRALEJO,HOTEL LAMBRADA  BAHIA DE LOBOS: Recepción,Oliva La,35660,FUERTEVENTURA,610192,3.17868e+006,20170908000000,
466,DESA00612,CALLE SAN CRISTOBAL DE LA LAGUNA 7 MASPALOMAS,HOTEL LABRANZA  BRONZE PLAYA: Recepción,San Bartolome de Tirajana,35110,GRAN CANARIA,444240,3.0709e+006,20170908000000,
467,DESA00613,CALLE PETREL  3 PLAYA DEL CURA,HOTEL IDYLL SUITES: Recepción,Mogan,35130,GRAN CANARIA,427821,3.07531e+006,20170908000000,
468,DESA00614,CTRA SAN NICOLAS 130,TERRERO DE LUCHA LAS MANCHAS: Entrada,Paso (El),38710,LA PALMA,218301,3.1675e+006,20170908000000,
469,DESA00615,AVDA ISLAS CANARIAS 18,AYUNTAMIENTO DE EL PASO: Entrada,Paso (El),38750,LA PALMA,218458,3.17282e+006,20170908000000,
470,DESA00616,AVDA ISLAS CANARIAS  S/N,CASA DE LA CULTURA : Recepción,Paso (El),38750,LA PALMA,218451,3.17292e+006,20170908000000,
471,DESA00617,PLAYA  CANCAJOS S/N,PLAYA LOS CANCAJOS: Puesto socorrismo 1,Breña Alta,38710,LA PALMA,230289,3.17252e+006,20170908000000,
472,DESA00618,PLAYA CANCAJOS  S/N,PLAYA LOS CANCAJOS: Puesto socorrismo 2,Breña Baja,38710,LA PALMA,230297,3.17253e+006,20170908000000,
473,DESA00619,PLAZA DE LAS MADRES S/N,AYUNTAMIENTO BREÑA BAJA: Entrada principal,Breña Baja,38710,LA PALMA,228296,3.17188e+006,20170908000000,
474,DESA00620,CALLE LEDAS (LAS) 6,CENTRO DE DIA LAS LEDAS: Entrada principal,Breña Baja,38712,LA PALMA,228058,3.1714e+006,20170908000000,
475,DESA00621,PLAZA DE LAS MADRES S/N,COMISARIA POLICIA LOCAL: Entrada,Breña Baja,38712,LA PALMA,228710,3.17188e+006,20170908000000,
476,DESA00622,CALLE EL MADROÑO  S/N,CAMPO DE FUTBOL: Entrada principal,Breña Baja,38712,LA PALMA,228627,3.17157e+006,20170908000000,
477,DESA00623,CMNO JOVER 1,CLUB NAUTICO DE JOVER: Recepción entrada derecha,Laguna (La),38260,TENERIFE,365816,3.15851e+006,20170908000000,
478,DESA00624,AVDA ALCALDE JOSE RAMIREZ BETHENCOURT 17,SODECAN GRAN CANARIA: Entrada Espacio Palett Express,Palmas de Gran Canaria (Las),35004,GRAN CANARIA,458726,3.11025e+006,20170908000000,
479,DESA00625,CALLE FLOR DE PASCUA 8,HOTEL STIL LOS GIGANTES: Recepción,Santiago del Teide,38683,TENERIFE,319266,3.12561e+006,20170908000000,
480,DESA00626,CALLE FLOR DE PASCUA 8,HOTEL STIL LOS GIGANTES: Entrada,Santiago del Teide,38683,TENERIFE,319286,3.12556e+006,20170908000000,
481,DESA00627,CAMPUS UNIVERSITARIO DE TAFIRA S/N,EDIFICIO DE CIENCIAS DE LA ACTIVIDAD FISICA Y DEL DEPORTE: Pasillo entre administración y Biblioteca,Palmas de Gran Canaria (Las),35017,GRAN CANARIA,455143,3.10494e+006,20170908000000,
482,DESA00628,CAMPUS UNIVERSITARIO DE TAFIRA S/N,EDIFICIO DE CIENCIAS ECONOMICAS Y DEL DEPORTE: Modulo C junto a escalera frente conserjería,Palmas de Gran Canaria (Las),35017,GRAN CANARIA,455839,3.10583e+006,20170908000000,
483,DESA00629,CAMPUS UNIVERSITARIO DE TAFIRA S/N,BIBLIOTECA GENERAL: Vestíbulo mostrador de conserjería,Palmas de Gran Canaria (Las),35017,GRAN CANARIA,455643,3.10565e+006,20170908000000,
484,DESA00630,CAMPUS UNIVERSITARIO DE TAFIRA S/N,EDIFICIO DE CIENCIAS BASICAS: Modulo Aulario. Pasillo Aulario y Química,Palmas de Gran Canaria (Las),35017,GRAN CANARIA,455570,3.10544e+006,20170908000000,
485,DESA00631,CAMPUS UNIVERSITARIO DE TAFIRA S/N,EDIFICIO ARQUITECTURA: Vestíbulo junto puerta conserjería,Palmas de Gran Canaria (Las),35017,GRAN CANARIA,455380,3.10533e+006,20170908000000,
486,DESA00632,CAMPUS UNIVERSITARIO DE TAFIRA S/N,EDIFICIO CIENCIAS JURÍDICAS: Modulo A pasillo hacia puerta emergencia,Palmas de Gran Canaria (Las),35017,GRAN CANARIA,455877,3.10606e+006,20170908000000,
487,DESA00633,CAMPUS UNIVERSITARIO DE TAFIRA S/N,EDIFICIO ELECTRONICA Y TELECOMUNICACIONES: Pabellón X tras puerta salida conserjería,Palmas de Gran Canaria (Las),35017,GRAN CANARIA,455411,3.10518e+006,20170908000000,
